COLLECTION	SPANSTART	TYPE	TEXT
405341	2833	O	Meil oli vastav arv möödunud aastal 46,7 , s.t. pisut vähem kui pooled korterivargad jõudsid ka kohtu ette ja said karistuse .
405341	2833	S	Meil oli vastav arv möödunud aastal 46,7 , s.t. pooled korterivargad jõudsid kohtu ette ja said karistuse .
			
650486	5978	O	Isiklikult usun aga , et tarkus on kindlasti rohkem kui ühemõõtmeline suurus .
650486	5978	S	Usun , et tarkus on ühemõõtmeline suurus .
			
388285	2409	O	Neid asju “ uuritakse ” juba rohkem kui aasta .
388285	2409	S	Neid asju “ uuritakse ” .
			
302105	242	O	Pank keskendub ka koostööle väikeste ja keskmise suurusega firmadega , plaanides suurendada selle sektori krediteerimist rohkem kui 50 miljoni lati võrra .
302105	242	S	Pank keskendub koostööle väikeste ja keskmise suurusega firmadega , plaanides suurendada selle sektori krediteerimist .
			
195409	519	O	Praegu paistab , et Leks kogub novembris umbes poolteist miljonit krooni preemiaid vähem kui oktoobris .
195409	519	S	Paistab , et Leks kogub novembris poolteist miljonit krooni preemiaid .
			
185306	1571	O	Rohkem kui 800 aktsionäriga Norma Liikmete AS-le kuulub 66 protsenti ettevõtte aktsiakapitalist .
185306	1571	S	800 aktsionäriga Norma Liikmete AS-le kuulub 66 protsenti ettevõtte aktsiakapitalist .
			
213194	1987	O	Aktsiaturud kalduvad seda fakti tähtsustama rohkem kui kohalikke uudiseid .
213194	1987	S	Aktsiaturud kalduvad seda fakti tähtsustama .
			
693370	1922	O	Loodud on hea alus edasi liikumiseks , ka usaldust on nüüd partnerite vahel rohkem kui enne läbirääkimiste algust .
693370	1922	S	Loodud on hea alus liikumiseks , usaldust on partnerite vahel rohkem kui enne läbirääkimiste algust .
			
583796	1469	O	Tol korral läks merre palju vähem kui 100 ( loe ja kirjuta – sada ! ) mikroskoopilist tonni ...
583796	1469	S	Tol korral läks merre ( loe ja kirjuta – sada ! ) mikroskoopilist tonni ...
			
695061	682	O	Tänavust eelarvet kasvatab kunstlikult rohkem kui 3 miljonit krooni õpetajate palgaraha , mis käib nüüd kohaliku omavalitsuse kaudu .
695061	682	S	Tänavust eelarvet kasvatab õpetajate palgaraha , mis käib kohaliku omavalitsuse kaudu .
			
227189	124	O	Kui veel 1999. aastal oli kinokülastatavus 1000 elaniku kohta Baltimaades üsna sarnane ( 500-600 ) , siis eelmisel aastal oli Eestis 1000 elaniku kohta 841 kinokülastust - üle kahe korra rohkem kui Leedus ja saja võrra rohkem kui Lätis .
227189	124	S	Kui 1999. aastal oli kinokülastatavus 1000 elaniku kohta Baltimaades sarnane ( 500 - 600 ) , eelmisel aastal oli Eestis 1000 elaniku kohta 841 kinokülastust .
			
572879	204	O	Aastatoodang kavatsetakse suurendada praeguse 6000 pealt 9000 autoni ning mudelivalikusse lubatakse lisada rohkem kui 700 hj superauto .
572879	204	S	Aastatoodang kavatsetakse suurendada praeguse 6000 pealt 9000 autoni ning mudelivalikusse lubatakse lisada .
			
93259	4172	O	Kui eksport hakkab hoogsalt kasvama ning jääb impordile alla vähem kui kümme protsenti , oleks see majanduse tervenemise positiivne signaal .
93259	4172	S	Kui eksport hakkab kasvama ning jääb impordile alla , oleks see majanduse tervenemise positiivne signaal .
			
686859	2399	O	Tema hinnangul ei näita tänavuse ametliku loenduse tulemus 550 ( 50 võrra vähem kui varasem 600 ) mitte loomade arvu tegelikku vähenemist , vaid loendajate asjatundlikkuse kasvu või kartust loomi üle loendada .
686859	2399	S	Tema hinnangul ei näita tänavuse ametliku loenduse tulemus 550 ( 50 võrra vähem kui varasem 600 ) loomade arvu tegelikku vähenemist , vaid loendajate asjatundlikkuse kasvu või kartust loomi üle loendada .
			
62881	1468	O	Külmetushaigusi on talviti ikka rohkem kui suvel , aga mingit epideemiat ei ole ma küll täheldanud .
62881	1468	S	Külmetushaigusi on rohkem kui suvel , aga mingit epideemiat ei ole ma täheldanud .
			
384744	27	O	“ Võlgu kaelas pole ja pangaarvelgi on rohkem kui üks kroon , “ ütleb AS Värska Vesi juhatuse esimees  Toivo Nõgesmäe  uhkusega .
384744	27	S	“ kaelas pole ja pangaarvelgi on rohkem kui üks kroon , “ ütleb AS Värska Vesi juhatuse esimees Toivo Nõgesmäe uhkusega .
			
655358	4318	O	Kui võtsin teist korda Ледокол kätte ja lugesin uuesti läbi , siis sain aru mis vahe on Jüri Linal ning Suvorovil ja miks ma viimast usun rohkem kui esimest .
655358	4318	S	Kui võtsin teist korda Ледокол kätte ja lugesin läbi , sain aru mis vahe on Jüri Linal ning Suvorovil ja miks ma viimast usun .
			
666293	1350	O	Kodus korraldatud läbu läbi kannatate kokkuvõttes samapalju kui pisivarguse puhul , moraalne kahju veel peale selle .
666293	1350	S	Kodus korraldatud läbu läbi kannatate kokkuvõttes , moraalne kahju veel peale selle .
			
266673	307	O	Isamaaliidu fraktsiooni esimehe Tiit Sinissaare sõnul oli eilse kohtumise eesmärk selgitada olukorda rohkem kui kirjas ja analüüsida võimalikke arenguid .
266673	307	S	Isamaaliidu fraktsiooni esimehe Tiit Sinissaare sõnul oli eilse kohtumise eesmärk selgitada olukorda ja analüüsida võimalikke arenguid .
			
28020	1070	O	Kokku sooritati börsil täna 154 tehingut 38 miljoni krooni väärtuses , mis on 18 miljonit krooni rohkem kui eile .
28020	1070	S	Sooritati börsil 154 tehingut 38 miljoni krooni väärtuses , mis on 18 miljonit krooni rohkem kui eile .
			
686431	1547	O	Selle plaani järgi ei tohiks kõrgema klassi vorstis olla lihasisaldus mitte vähem kui 95% .
686431	1547	S	Selle plaani järgi ei tohiks kõrgema klassi vorstis olla lihasisaldus vähem kui 95% .
			
19450	673	O	1998. aastal müüsid Eesti autokaupmehed 10.457 uut autot ehk 619 autot vähem kui aasta varem .
19450	673	S	1998. aastal müüsid Eesti autokaupmehed 10.457 uut autot ehk 619 autot .
			
700816	1182915	O	Teatavasti võib korteriomandi seadmisega olla kõige suuremaid probleeme Tallinna linnal , kus praegu on rohkem kui 100 000 korterit sisuliselt ilma maata .
700816	1182915	S	Võib korteriomandi seadmisega olla suuremaid probleeme Tallinna linnal , kus on 100 000 korterit ilma maata .
			
510166	103	O	Jaanuaris ja veebruaris registreeris politsei 6648 kuritegu , mis on 679 kuritegu rohkem kui mullu sama aja jooksul , teatas politseiameti pressiesindaja .
510166	103	S	Jaanuaris ja veebruaris registreeris politsei 6648 kuritegu , mis on 679 kuritegu rohkem kui sama aja jooksul , teatas politseiameti pressiesindaja .
			
438417	5785	O	Kõigepealt - hommikutaevas on lendtähti ligi kaks korda rohkem kui õhtutaevas .
438417	5785	S	- hommikutaevas on lendtähti kaks korda rohkem kui õhtutaevas .
			
474768	852	O	Pearahakoefitsiendi , pearaha suuruse ja valla õpilaste arvu korrutisest moodustubki valla õpetajate palgafond , mis ei tohi 1997. aasta lõpu seisust erineda rohkem kui 2,5 protsenti .
474768	852	S	Pearahakoefitsiendi , pearaha suuruse ja valla õpilaste arvu korrutisest moodustubki valla õpetajate palgafond , mis ei tohi 1997. aasta lõpu seisust erineda .
			
204953	439	O	""" Labadel oli remonti vajavaid kohti isegi rohkem kui tehase esindajatel parandamiseks materjali kaasas oli ."
204953	439	S	""" Labadel oli remonti vajavaid kohti ."
			
127476	675	O	Iga raamatut müüdi keskmiselt kümme korda rohkem kui Eestis ilukirjandust tavaliselt .
127476	675	S	Iga raamatut müüdi kümme korda kui ilukirjandust .
			
332194	1806	O	Praegu on tööturul oskustöölisi vähem kui valgekraesid ning suuremad tööstusinvesteeringud jäävad tööjõu nappuse tõttu pigem siia tulemata .
332194	1806	S	On tööturul oskustöölisi vähem kui valgekraesid ning suuremad tööstusinvesteeringud jäävad tööjõu nappuse tõttu tulemata .
			
146444	50	O	Põllul valmib sel aastal üle aastate suurim viljasaak , hinnanguliselt 100 000 tonni rohkem kui aasta varem .
146444	50	S	Põllul valmib sel aastal üle aastate suurim viljasaak .
			
12468	1725	O	Tema sõnul on palavate ilmadega kiirabihaiglasse sattunud südamehaigeid rohkem kui tavaliselt .
12468	1725	S	Tema sõnul on palavate ilmadega kiirabihaiglasse sattunud südamehaigeid .
			
129853	178	O	Mõrvades süüdistatav Aleksander Pitšuškin ise väidab , et ta on tapnud rohkem kui 49 inimest , kirjutab BBC .
129853	178	S	Mõrvades süüdistatav Aleksander Pitšuškin ise väidab , et ta on tapnud , kirjutab BBC .
			
652378	43976	O	Maaks@joob piima rohkem kui õlut
652378	43976	S	Maaks @ joob piima
			
8863	1667	O	Teiseks mitmekordselt alahinnatud objektiks oli Kadaka ristmiku renoveerimise rohkem kui kolm korda kallimaks osutumine .
8863	1667	S	Alahinnatud objektiks oli Kadaka ristmiku renoveerimise kolm korda kallimaks osutumine .
			
173992	1600	O	Firmal on valmis vorstikesti laos rohkem kui 500 000 krooni eest , mis tuleb maha kanda .
173992	1600	S	Firmal on valmis vorstikesti laos .
			
3920	9562	O	Vähem kui aastaga on käive kasvanud üle 30 protsendi .
3920	9562	S	Kui aastaga on käive kasvanud üle 30 protsendi .
			
547013	1719	O	M2G- ja N2G-kategooriasse  kuuluvad bussid ja veo- ning maastikuautod , mille täismass on rohkem kui 2 , kuid ei ületa 12 tonni , millel veavad kõik rattad või roomikud ja vähemalt üks telgedest on lahutatav jõuülekandest ning auto peab vastama kolmele esitatavale nõudele .
547013	1719	S	M2G- ja N2G-kategooriasse kuuluvad bussid ja veo- ning maastikuautod , mille täismass on rohkem kui 2 , kuid ei ületa 12 tonni , millel veavad kõik rattad või roomikud ja üks telgedest on lahutatav jõuülekandest ning auto peab vastama kolmele esitatavale nõudele .
			
666002	1012	O	"Spordiroodu tahtjaid on palju rohkem kui kohti . """
666002	1012	S	"Spordiroodu tahtjaid on rohkem kui kohti . """
			
699079	11917	O	Numbrid räägivad selget keelt : me kulutame rohkem kui toodame .
699079	11917	S	Numbrid räägivad selget keelt : me kulutame kui toodame .
			
252201	1342	O	Gazprom on ostnud Kohtla-Järvel asuva Nitroferdi ja kavatseb suunata sinna veidi vähem kui kolme miljardi krooni eest investeeringuid tootmaks Euroopale metanooli .
252201	1342	S	Gazprom on ostnud Kohtla-Järvel asuva Nitroferdi ja kavatseb suunata investeeringuid tootmaks Euroopale metanooli .
			
635293	357	O	""" Tänavune mess on rohkem kui kunagi varem suunatud laiale arvutikasutajate ringile , "" tõdes messi direktor Aalo Kukk ."
635293	357	S	""" Tänavune mess on suunatud laiale arvutikasutajate ringile , "" tõdes messi direktor Aalo Kukk ."
			
290654	12	O	President Lennart Meri annab oma viimasel ametiaastal umbes 590 inimesele vabariigi aastapäeval ordeni või medali , mis on 422 võrra rohkem kui eelmisel aastal .
290654	12	S	President Lennart Meri annab oma viimasel ametiaastal 590 inimesele vabariigi aastapäeval ordeni või medali , mis on 422 võrra rohkem kui eelmisel aastal .
			
700946	403794	O	raha pakun vastavalt kere seisukorrale aga rohkem kui emex
700946	403794	S	Raha pakun kere seisukorrale
			
660091	20288	O	Praktiliselt võib jooni käsitada paralleelsetena , kui väärtused ( SH-SL ) ja ( UH-UL ) ei erine rohkem kui 10% võrra oma keskmisest väärtusest .
660091	20288	S	Võib jooni käsitada paralleelsetena , kui väärtused ( SH-SL ) ja ( UH-UL ) ei erine oma keskmisest väärtusest .
			
678593	3783	O	Tänapäeva laps teab seksist rohkem kui meie , täiskasvanud , arvame .
678593	3783	S	Tänapäeva laps teab seksist , arvame .
			
276036	1477	O	Mis puutub bussipileti kõrgemasse hinda võrreldes rongide omaga , siis ei maksa unustada , et riik doteeris rongipiletit ka hoopis rohkem kui bussipiletit .
276036	1477	S	Mis puutub bussipileti kõrgemasse hinda võrreldes rongide omaga , ei maksa unustada , et riik doteeris rongipiletit .
			
304615	501	O	Klaipeda sadamas laaditi ja lossiti möödunud aastal 6554 alust ehk 16,3 protsenti rohkem kui 1999. aastal .
304615	501	S	Klaipeda sadamas laaditi ja lossiti möödunud aastal 6554 alust .
			
26704	29	O	Lauri Vihman teab nimetada rohkem kui kolme firmat , kus tal õnnestus töövestlusel käies personalijuhid oma teadmistega nurka suruda .
26704	29	S	Lauri Vihman teab nimetada .
			
119847	792	O	Rohkem kui 1500 krooni kuus pole võimalik laenata .
119847	792	S	1500 krooni kuus pole võimalik laenata .
			
229683	121	O	Kolme masinakirjaleheküljelise diktofoniintervjuu eest maksab päevaleht rohkem kui kirjandusajakiri pika novelli eest .
229683	121	S	Kolme masinakirjaleheküljelise diktofoniintervjuu eest maksab päevaleht .
			
5333	120	O	"Tartus peetud seminaril Toiduenergia 99 valis rohkem kui kakssada Eesti tudengit oma lemmiksordiks "" Tere "" karamellipudingu ."
5333	120	S	"Tartus peetud seminaril Toiduenergia 99 valis oma lemmiksordiks "" Tere "" karamellipudingu ."
			
389722	2731	O	Orhideed ehk käpalised on suuruselt teine õistaimede sugukond maailmas , kuhu kuulub rohkem kui 18 500 liiki .
389722	2731	S	Orhideed ehk käpalised on teine õistaimede sugukond maailmas , kuhu kuulub .
			
571186	0	O	Möödunud nädalal tunnistas Microsofti endine töötaja end süüdi tarkvarafirma toodete ebaseadusliku müügiga rohkem kui 7 miljoni dollari ( 84 miljonit Eesti krooni ) teenimises .
571186	0	S	Möödunud nädalal tunnistas Microsofti endine töötaja end tarkvarafirma toodete ebaseadusliku müügiga 7 miljoni dollari ( 84 miljonit Eesti krooni ) teenimises .
			
705248	237624	O	le4f: ta on rohkem kui tore ;)
705248	237624	S	Le4f : ta on tore ;)
			
240215	4420	O	""" Mehi on siin vähem kui naisi ."
240215	4420	S	""" Mehi on vähem kui naisi ."
			
234834	967	O	Ametiau maksab igatahes rohkem kui 1854 krooni kuus !
234834	967	S	Ametiau maksab 1854 krooni kuus !
			
589146	1188	O	NBAs pingutavad nad palju rohkem kui siin .
589146	1188	S	NBAs pingutavad nad .
			
624220	2299	O	ÜKSNES EESTI toob Ateenasse 42 sportlast , kolm korda rohkem kui spordiajaloo suurvõim USA 1896. aastal .
624220	2299	S	EESTI toob Ateenasse 42 sportlast , kolm korda rohkem kui spordiajaloo suurvõim USA 1896. aastal .
			
591671	16	O	Esimesse klassi läks umbes 21 000 last ehk tuhatkond vähem kui aasta varem .
591671	16	S	Esimesse klassi läks 21 000 last ehk tuhatkond .
			
243603	966	O	USA välisministeeriumi värske raport väidab , et mullu kasvas rahvusvaheline terroristlik aktiivsus ja kuigi intsidentide hulk kasvas vaid 31 võrra , hukkus neis inimesi ligi kaks korda rohkem kui aasta varem ( vastavalt 405 ja 233 ) .
243603	966	S	USA välisministeeriumi värske raport väidab , et kasvas rahvusvaheline terroristlik aktiivsus ja intsidentide hulk kasvas 31 võrra , hukkus neis inimesi ( vastavalt 405 ja 233 ) .
			
700946	1068182	O	Või kui viitsid , siis OHC 2.0 pritse , millel on jõudu isegi rohkem kui 2.3-l .
700946	1068182	S	Või kui viitsid , siis OHC 2.0 pritse , millel on jõudu .
			
321612	407	O	Maksu- ja tolliametisse laekus tänavu rekordiliselt 677 deklaratsiooni , kus 2004. aasta kohta oli kirja pandud rohkem kui miljonikroonine tulu .
321612	407	S	Maksu- ja tolliametisse laekus 677 deklaratsiooni , kus 2004. aasta kohta oli kirja pandud miljonikroonine tulu .
			
428	2127	O	Edgarile meeldib seal rohkem kui linnas .
428	2127	S	Edgarile meeldib .
			
280135	2510	O	""" Meil on võlausaldajaid rohkem kui vaid pangad , "" kommenteeris Mülleri väiteid Urm ."
280135	2510	S	""" Meil on võlausaldajaid rohkem kui pangad , "" kommenteeris Mülleri väiteid Urm ."
			
665762	14631	O	1 ) palga väljamaksmiseks , kuid mitte rohkem kui kahe kuu eest ;
665762	14631	S	1 ) palga väljamaksmiseks , kuid rohkem kui kahe kuu eest ;
			
613535	2087	O	Kuulitõuke 14.58 tähendas meetrit vähem kui isikliku rekordi püstitamisel ning kõrgushüppe 1.92 andis lõplikult kinnituse , et tipptasemel summat Rahnu seekord ei püüa .
613535	2087	S	Kuulitõuke 14.58 tähendas meetrit kui isikliku rekordi püstitamisel ning kõrgushüppe 1.92 andis kinnituse , et tipptasemel summat Rahnu ei püüa .
			
695358	1043	O	Tänavu maksis ka pilet rohkem kui varasemail aastail .
695358	1043	S	Maksis pilet .
			
191962	2349	O	See on rohkem kui 69,5 miljonit krooni , mida niigi pingelisest riigieelarvest peaks selle seaduse rakendamiseks justiitsministeeriumile eraldatama .
191962	2349	S	See on 69,5 miljonit krooni , mida pingelisest riigieelarvest peaks selle seaduse rakendamiseks justiitsministeeriumile eraldatama .
			
445012	580	O	Siis oli manulisi järel kolm rohkem kui autasusid .
445012	580	S	Oli manulisi järel .
			
545707	1214	O	“ Rohkem kui 120-tunnise õppemahuga firma peab looma erakooli ja taotlema koolitusluba , ” selgitas Ilbis .
545707	1214	S	“ 120-tunnise õppemahuga firma peab looma erakooli ja taotlema koolitusluba , ” selgitas Ilbis .
			
667937	2720	O	Tänavu kandideeris auhinnale 39 ajakirjanikku rohkem kui 200 tööga .
667937	2720	S	Kandideeris auhinnale 39 ajakirjanikku .
			
290489	483	O	Naistennisistidest on rohkem kui miljoni väärtuses auhinnarahasid saanud veel Martina Hingis ( 1,38 ) , Serena Williams ( 1,34 ) ja Lindsay Davenport ( 1,15 ) .
290489	483	S	Naistennisistidest on miljoni väärtuses auhinnarahasid saanud Martina Hingis ( 1,38 ) , Serena Williams ( 1,34 ) ja Lindsay Davenport ( 1,15 ) .
			
6356	1162	O	Ainuüksi 1944. aasta üheksa kuu kaitselahingutes kaotasid vabadusvõitlejad 15 000 langenut , mis on kolm korda rohkem kui Vabadus-sõjas .
6356	1162	S	1944. aasta üheksa kuu kaitselahingutes kaotasid vabadusvõitlejad 15 000 langenut , mis on kolm korda rohkem kui Vabadus-sõjas .
			
156194	273	O	""" Kindlasti oli haigeid viimasel ajal rohkem kui jaanuaris-veebruaris , aga terve talve jooksul on neid olnud palju , "" ütles Torp ."
156194	273	S	""" oli haigeid viimasel ajal rohkem kui jaanuaris-veebruaris , aga terve talve jooksul on neid olnud palju , "" ütles Torp ."
			
636862	1338	O	BDG juhatuse esimees Peeter Rebane unistab , et Iron Maidenit tuleb kuulama rohkem kui 20 000 inimest .
636862	1338	S	BDG juhatuse esimees Peeter Rebane unistab , et Iron Maidenit tuleb kuulama .
			
388248	1028	O	Natuke rohkem kui tunni aja pärast oli Männikul kohal ka Eesti riigi juhtkond .
388248	1028	S	Tunni aja pärast oli Männikul kohal Eesti riigi juhtkond .
			
701969	506	O	oiblää , mul vanaisa oleks kohe auliige siin klubis , tal laseb ikka rohkem kui 3 pudelit päevas , aga kahjuks tal ei ole planetis kontot ja tglt ta ei oska üldse arvutit kasutada .
701969	506	S	Oiblää , mul vanaisa oleks auliige klubis , tal laseb , aga tal ei ole planetis kontot ja tglt ta ei oska arvutit kasutada .
			
257610	966	O	""" Tööst tulenevalt kestis eelmisel aastal mitme Kadrioru ametniku puhkus vähem kui 27 päeva ja seegi suvi tuleb paljudele töine , "" lausus Alatalu ."
257610	966	S	""" kestis eelmisel aastal mitme Kadrioru ametniku puhkus ja seegi suvi tuleb paljudele töine , "" lausus Alatalu ."
			
95366	1933	O	USA-s mõisteti teisipäeval rohkem kui kolmeks aastaks vangi kaks Leedu kodanikku , kes püüdsid müüa 40 õhutõrjeraketti USA salaluureagentidele , pidades neid Kolumbia narkokartelli liikmeiks .
95366	1933	S	USA-s mõisteti teisipäeval kolmeks aastaks vangi kaks Leedu kodanikku , kes püüdsid müüa 40 õhutõrjeraketti USA salaluureagentidele , pidades neid Kolumbia narkokartelli liikmeiks .
			
655333	5835	O	põhjamaades , kus seaduste vastu eksinute rehabiliteerimine on läbimõeldult korraldatud ( mõningate meelest vangide poputamine ja varustamine liiga heade tingimustega ) , satub uuesti kohtu alla natuke rohkem kui 40% esimest korda karistatutest .
655333	5835	S	Põhjamaades , kus seaduste vastu eksinute rehabiliteerimine on läbimõeldult korraldatud ( mõningate meelest vangide poputamine ja varustamine heade tingimustega ) , satub kohtu alla .
			
377772	162	O	Rohkem kui poolesaja eseme hulgas on ka pangavarustust , näiteks rahalaekaid ja seife .
377772	162	S	Kui poolesaja eseme hulgas on pangavarustust , näiteks rahalaekaid ja seife .
			
630228	32662	O	Kui artiklis 11 ettenähtud tähtaegadest ei peeta kinni kokku vähem kui 60 päeva ulatuses , arvestatakse töötlemistagatisest maha 4 eküüd tonni kohta päevas .
630228	32662	S	Kui artiklis 11 ettenähtud tähtaegadest ei peeta kinni kokku , arvestatakse töötlemistagatisest maha 4 eküüd tonni kohta päevas .
			
310933	81	O	Tänavu läheb esimesse klassi 14 050 last , eelmisel sügisel alustas kooliteed 15 161 last ehk 1111 last rohkem kui algaval õppeaastal .
310933	81	S	Läheb esimesse klassi 14 050 last , eelmisel sügisel alustas kooliteed 15 161 last ehk 1111 last .
			
268441	353	O	Avamine seisab puuduvate lubade taga , mille hankimine ei tohiks võtta rohkem kui kaks nädalat .
268441	353	S	Avamine seisab puuduvate lubade taga , mille hankimine ei tohiks võtta .
			
42612	1569	O	Kui perel jääb pärast eluasemekulude tasumist kätte vähem kui toimetulekupiiriga määratletud 500 krooni , siis maksab linnaosa valitsus ka elatustoetust .
42612	1569	S	Kui perel jääb pärast eluasemekulude tasumist kätte , maksab linnaosa valitsus elatustoetust .
			
100625	0	O	Kui Euroopa Komisjon pakkus uutele liikmesriikidele mitmesugust toetusraha vähem kui praegustele liikmetele ette nähtud , siis olid kandidaadid pahased .
100625	0	S	Kui Euroopa Komisjon pakkus uutele liikmesriikidele mitmesugust toetusraha kui praegustele liikmetele ette nähtud , olid kandidaadid pahased .
			
100392	414	O	See andis usku ja lootust ja seda jõudu , mida aasta kulutas rohkem kui ootasin .
100392	414	S	See andis usku ja lootust ja seda jõudu , mida aasta kulutas ootasin .
			
307196	661	O	Algviisikud selgusid rohkem kui 500 hääletanu valiku põhjal .
307196	661	S	Algviisikud selgusid 500 hääletanu valiku põhjal .
			
105935	2079	O	Lapsepuhkust küll võetakse , kuid tunduvalt vähem kui enne seadusemuudatust , kinnitas EMT personalijuht Heidi Jusson .
105935	2079	S	Lapsepuhkust võetakse , kuid vähem kui enne seadusemuudatust , kinnitas EMT personalijuht Heidi Jusson .
			
455703	915	O	“ Kui keegi seletab seda imet , miks peaks tuleva aasta veebruaris laekuma makse tunduvalt rohkem kui täna , siis peaks ikka hästi selgelt seletama , kust see kasv ikka nii äkki tekib , ” ütles riigikontrolör Juhan Parts Postimehele .
455703	915	S	“ Kui keegi seletab seda imet , miks peaks tuleva aasta veebruaris laekuma makse , peaks seletama , kust see kasv tekib , ” ütles riigikontrolör Juhan Parts Postimehele .
			
80980	39	O	PIKAEALISED : Eestis elab rohkem kui poolsada saja-aastast inimest
80980	39	S	PIKAEALISED : Eestis elab poolsada saja-aastast inimest
			
317059	1459	O	Uus piletisüsteem on Vilba hinnangul kasulik neile inimestele , kes kasutavad ühistransportri vähem kui 100 korda kuus .
317059	1459	S	Uus piletisüsteem on Vilba hinnangul kasulik neile inimestele , kes kasutavad ühistransportri .
			
610033	2397	O	Vaatamata rohkem kui kümneaastasele Eesti poliitikas olemisele on Mart Laar mulle väga vähe tuttav inimene .
610033	2397	S	Vaatamata kui kümneaastasele Eesti poliitikas olemisele on Mart Laar mulle tuttav inimene .
			
613847	1480	O	Enesetsensuuri on aga Euroopa maades hulga rohkem kui Venemaal , kus « poliitkorrektsusest » veel suurt ei hoolita .
613847	1480	S	Enesetsensuuri on Euroopa maades rohkem kui Venemaal , kus « poliitkorrektsusest » suurt ei hoolita .
			
575280	5838	O	Aastate peale kokku on mul esikohti rohkem kui teisi kohti ning juba seetõttu oleks vale midagi kahetseda .
575280	5838	S	Aastate peale on mul .
			
356261	994	O	Kui ametnikud trükikoormuse täies ulatuses ära kasutaksid , trükiks nad ainuüksi uute printeritega rohkem kui 2,5 miljonit lehekülge kuus ehk 115 000 lehekülge igal tööpäeval .
356261	994	S	Kui ametnikud trükikoormuse täies ulatuses ära kasutaksid , trükiks nad uute printeritega .
			
42451	0	O	Mart Laar vastas täna Isamaaliidu kodulehekülje foorumis talle esitatud rohkem kui kuuekümnele küsimusele .
42451	0	S	Mart Laar vastas .
			
3357	19463	O	Selle kasutamise TriCore-le tuginevais süsteemikiipides muudab ahvatlevaks asjaolu , et operatsioonisüsteem vajab vähem kui 3700 baiti mälumahtu .
3357	19463	S	Selle kasutamise TriCore-le tuginevais süsteemikiipides muudab ahvatlevaks asjaolu , et operatsioonisüsteem vajab 3700 baiti mälumahtu .
			
558579	2799	O	Nädala jooksul rohkem kui 26 napsu tarbiv naine võib end lugeda juba alkohoolikuks .
558579	2799	S	Nädala jooksul 26 napsu tarbiv naine võib end lugeda alkohoolikuks .
			
132675	2355	O	""" Võib-olla kaasneb see vanusega ja me ise tekitame muresid rohkem kui peaks , "" oletas ta ."
132675	2355	S	""" kaasneb see vanusega ja me ise tekitame muresid kui peaks , "" oletas ta ."
			
700912	151126	O	Juba rohkem kui kaks sajandit lollitatakse nendega ja rahval isu täis ei saa kas rahvas siis ongi ainult lambakari ?
700912	151126	S	Lollitatakse nendega ja rahval isu täis ei saa rahvas ongi lambakari ?
			
408118	1791	O	Juba rohkem kui nädalapäevad töötab katusel teine meeskond .
408118	1791	S	Töötab katusel teine meeskond .
			
438382	1016	O	Kultuuri- ja spordiüritusi on ette näha rohkem kui eelmistel aastatel .
438382	1016	S	Kultuuri- ja spordiüritusi on ette näha .
			
187343	40	O	Tshehhi idaosa tabanud metsikute paduvihmade järel jõudis selle sajandi rängim üleujutus eile kahe suure linnani , surma on saanud vähemalt üheksa inimest , kadunute arv ulatub rohkem kui kümneni .
187343	40	S	Tshehhi idaosa tabanud metsikute paduvihmade järel jõudis selle sajandi rängim üleujutus kahe suure linnani , surma on saanud üheksa inimest , kadunute arv ulatub .
			
78071	1308	O	Vihmavett tuli üldse dekaadis maha kaks korda rohkem kui tavaliselt .
78071	1308	S	Vihmavett tuli dekaadis maha .
			
391837	3443	O	Vähem kui 10-20% osteoporoosihaigetest saab õigeaegset ravi .
391837	3443	S	Osteoporoosihaigetest saab õigeaegset ravi .
			
