COLLECTION	SPANSTART	TYPE	TEXT
256760	685	O	Praegu saavad vähem arenenud piirkonnad EL-ilt abi , kui nende sissetulek on vähem kui 75 protsenti EL-i keskmisest sisemajanduse kogutoodangust .
256760	685	S	Saavad arenenud piirkonnad EL-ilt abi , kui nende sissetulek on 75 protsenti EL-i keskmisest sisemajanduse kogutoodangust .
			
476758	473	O	Spordimuuseumi kogu koosneb praegu rohkem kui 70 000 eksponaadist - nende seas on medaleid-märke , fotosid , raamatuid , spordivahendeid , auhindu .
476758	473	S	Spordimuuseumi kogu koosneb - nende seas on medaleid-märke , fotosid , raamatuid , spordivahendeid , auhindu .
			
232799	4088	O	Turu mõte on ekspansiivne turg ise : tarbida-toota-osta-müüa-vahetada homme rohkem kui täna .
232799	4088	S	Turu mõte on ekspansiivne turg ise : tarbida-toota-osta-müüa-vahetada .
			
598951	0	O	Rohkem kui tuhandel Baltimaade elanikul on õigus Suurbritannialt hüvitust nõuda , sest Briti valitsus võttis Teise maailmasõja ajal nendelt vara .
598951	0	S	Tuhandel Baltimaade elanikul on õigus Suurbritannialt hüvitust nõuda , sest Briti valitsus võttis Teise maailmasõja ajal nendelt vara .
			
66674	1210	O	Hollandlane informeeris politseinike tegevusest otse siseministrit , kes käskis politseiametil algatada teenistusliku juurdluse , mis tuvastas politseinike süü vähem kui ööpäevaga .
66674	1210	S	Hollandlane informeeris politseinike tegevusest siseministrit , kes käskis politseiametil algatada teenistusliku juurdluse , mis tuvastas politseinike süü .
			
184363	355	O	Pärnu teedevalitsuse juhataja Enn Raadik lisas , et peatöövõtjale AS Aspile ja hulgale alltöövõtjatele ei saa hilinemise pärast midagi ette heita , sest teetöö ei sõltu ilmastikust sugugi vähem kui põllumeestel heinategu .
184363	355	S	Pärnu teedevalitsuse juhataja Enn Raadik lisas , et peatöövõtjale AS Aspile ja hulgale alltöövõtjatele ei saa hilinemise pärast midagi ette heita , sest teetöö ei sõltu ilmastikust .
			
189245	770	O	Eelmisel aastal maksis riik sotsiaalministeeriumi kaudu kinni üle 2000 imikupaki , omavalitsused tegid sellise kingituse ühtekokku rohkem kui 1000 perele .
189245	770	S	Eelmisel aastal maksis riik sotsiaalministeeriumi kaudu kinni üle 2000 imikupaki , omavalitsused tegid sellise kingituse .
			
197259	259	O	Järgmise aasta sügiseks laiendatakse kaupluse müügipinda rohkem kui 1000 ruutmeetri võrra ning optimaalse kaubavalikuga lähikauplusest saab Maxima supermarket .
197259	259	S	Järgmise aasta sügiseks laiendatakse kaupluse müügipinda ning optimaalse kaubavalikuga lähikauplusest saab Maxima supermarket .
			
264494	795	O	Elamurajooni oli kavandatud 84 maja , odavate majade järjekorda on end juba seadnud rohkem kui 100 inimest .
264494	795	S	Elamurajooni oli kavandatud 84 maja , odavate majade järjekorda on end seadnud .
			
59051	2141	O	Aasta esimeses pooles müüdi Nokiaid viis ja enamgi korda rohkem kui Ericssoni telefone .
59051	2141	S	Aasta esimeses pooles müüdi Nokiaid viis ja korda rohkem kui Ericssoni telefone .
			
417308	1902	O	ELis kehtib norm , mille kohaselt ühe pakkeüksuse viljad ei tohi erineda rohkem kui 0,5 cm ( 5 kuni 10 protsenti hälbeid on lubatud ) .
417308	1902	S	ELis kehtib norm , mille kohaselt ühe pakkeüksuse viljad ei tohi erineda ( 5 kuni 10 protsenti hälbeid on lubatud ) .
			
700818	799396	O	Me leiame , et see on isegi vähem kui pool lahendust .
700818	799396	S	Me leiame , et see on vähem kui pool lahendust .
			
613049	2656	O	Seejuures sünnib tüdrukuid siiami kaksikutena kolm korda rohkem kui poisse .
613049	2656	S	Sünnib tüdrukuid siiami kaksikutena kolm korda .
			
621871	267	O	Kui keskmise Nokia telefoni hind on umbes 1600 krooni , siis Vertu kõnetorude kallimad versioonid maksavad rohkem kui 60 000 krooni ja neid müüakse aasta jooksul kümneid tuhandeid .
621871	267	S	Kui keskmise Nokia telefoni hind on 1600 krooni , Vertu kõnetorude kallimad versioonid maksavad ja neid müüakse aasta jooksul kümneid tuhandeid .
			
588952	1717	O	"Meil töötab küll juba rohkem kui aasta arst-pastor . """
588952	1717	S	"Meil töötab . """
			
614527	3024	O	Naised tunnetavad seda rohkem kui mehed , sest nemad ei ole nii aktiivselt selle jubeduse loomises kaastegevad .
614527	3024	S	Naised tunnetavad seda , sest nemad ei ole selle jubeduse loomises kaastegevad .
			
644355	4555	O	Abi ei anta , kui lepingujärgne ladustamine kestab vähem kui 60 päeva .
644355	4555	S	Abi ei anta , kui lepingujärgne ladustamine kestab .
			
233114	3827	O	Seega kokku peaaegu 40 korda rohkem kui rongide kasutamisel .
233114	3827	S	40 korda rohkem kui rongide kasutamisel .
			
252832	1084	O	Perelabori andmeil kulutas eelmise aasta lõpus rohkem kui poole oma tulust toiduainete ostmisele viiendik Eesti elanikest .
252832	1084	S	Perelabori andmeil kulutas eelmise aasta lõpus viiendik Eesti elanikest .
			
74637	976	O	Esialgsete plaanide järgi peaks ümbermaailmareis kestma rohkem kui poolteist aastat .
74637	976	S	Esialgsete plaanide järgi peaks ümbermaailmareis kestma .
			
236644	933	O	Seal peavad robotsõidukid läbima vähem kui kuue tunniga 60-miilise ( 96,5 km ) teekonna , täites samal ajal sõjalise iseloomuga transpordiülesandeid .
236644	933	S	Peavad robotsõidukid läbima 60-miilise ( 96,5 km ) teekonna , täites samal ajal sõjalise iseloomuga transpordiülesandeid .
			
463556	17	O	Autorikaitseõigustest kinnipidamist jälgivad organisatsioonid peavad lõppevat aastat edukaks , sest piraatkoopiaid õnnestus konfiskeerida viis korda rohkem kui mullu .
463556	17	S	Autorikaitseõigustest kinnipidamist jälgivad organisatsioonid peavad lõppevat aastat edukaks , sest piraatkoopiaid õnnestus konfiskeerida .
			
548599	0	O	Kojamees , kodanikunimega Tarmo Kruusimägi , kes on elu jooksul proovinud rohkem kui üheksat ametit , leiab , et on seeläbi vaid võitnud .
548599	0	S	Kojamees , kodanikunimega Tarmo Kruusimägi , kes on elu jooksul proovinud , leiab , et on võitnud .
			
35129	152	O	Pensionil bussijuht Emile Louis võib aga karistusest pääseda , sest Prantsuse seaduste järgi ei saa teda süüdistada mõrvas , mis on toime pandud rohkem kui kümne aasta eest .
35129	152	S	Pensionil bussijuht Emile Louis võib aga karistusest pääseda , sest Prantsuse seaduste järgi ei saa teda süüdistada mõrvas , mis on toime pandud .
			
595145	406	O	Esimesel päeval kogutud 4398 punkti oli 138 punkti vähem kui Eesti rekordi püstitamisel siinsamas Götzises kaks aastat tagasi .
595145	406	S	Esimesel päeval kogutud 4398 punkti .
			
498064	722	O	Viimase kümne aasta vältel on Saal omandanud kogemusi rohkem kui kümnel konkursil Itaalias , Ungaris , Rootsis jm.
498064	722	S	Viimase kümne aasta vältel on Saal omandanud kogemusi
			
105935	5068	O	Sest miks peaks riik maksma ühele emale rohkem kui teisele , tulevad ju rahad riigieelarvest .
105935	5068	S	Sest miks peaks riik maksma ühele emale , tulevad rahad riigieelarvest .
			
89764	44	O	Itaalia kohus on mõistnud riigi endisele peaministrile ja eluaegsele senaatorile Giulio Andreottile 24-aastase vanglakaristuse , süüdistades teda rohkem kui kahe aastakümne taguses ajakirjaniku mõrva tellimises maffialt .
89764	44	S	Itaalia kohus on mõistnud riigi endisele peaministrile ja eluaegsele senaatorile Giulio Andreottile 24-aastase vanglakaristuse , süüdistades teda ajakirjaniku mõrva tellimises maffialt .
			
577446	0	O	Maanteeameti statistika kohaselt hukkus tänavu veebruaris liiklusõnnetustes viis inimest ehk kaks vähem kui mullu samal ajal.
577446	0	S	Maanteeameti statistika kohaselt hukkus veebruaris liiklusõnnetustes viis inimest ehk kaks vähem kui samal ajal .
			
692686	5457	O	Teadmiseks , praegu on Eesti pindalast metsade all pea poole rohkem kui enne sõda ning kaetuse protsent kasvab aeglaselt , kuid järjekindlalt .
692686	5457	S	Teadmiseks , on Eesti pindalast metsade all pea poole rohkem kui enne sõda ning kaetuse protsent kasvab .
			
513006	0	O	Rohkem kui kaks kuud palgata olevad Kalevi korvpallurid on kõige suuremas teadmatuses .
513006	0	S	Kaks kuud palgata olevad Kalevi korvpallurid on suuremas teadmatuses .
			
105713	1192	O	Nukuteatrilt tellitakse 24.300 külastajat vähem kui teater teenindada suudaks , Endla tellimus on 15.500 külastaja ja Rakvere teatri tellimus 10.000 külastaja võrra planeeritust väiksem .
105713	1192	S	Nukuteatrilt tellitakse 24.300 külastajat kui teater teenindada suudaks , Endla tellimus on 15.500 külastaja ja Rakvere teatri tellimus 10.000 külastaja võrra planeeritust väiksem .
			
411134	2070	O	x 5-10 aastat - mitte vähem kui kolm kuud
411134	2070	S	X 5 - 10 aastat
			
375354	14	O	Rohkem kui 100 000 krooni kadumine Valga kultuuri- ja huvialakeskusest tõi linnavalitsuse avalduse alusel kaasa kriminaalmenetluse .
375354	14	S	100 000 krooni kadumine Valga kultuuri- ja huvialakeskusest tõi linnavalitsuse avalduse alusel kaasa kriminaalmenetluse .
			
204753	1275	O	Treeneril , kes tahab võita rohkem kui ühe mängu , peab olema teadmisi psühholoogiast , füsioloogiast , treeningumetoodikast ja veel paljudest valdkondadest .
204753	1275	S	Treeneril , kes tahab võita kui ühe mängu , peab olema teadmisi psühholoogiast , füsioloogiast , treeningumetoodikast ja paljudest valdkondadest .
			
325289	2795	O	Kogu päästeoperatsioon vältas vähem kui pool tundi .
325289	2795	S	Kogu päästeoperatsioon vältas .
			
71816	191	O	Riiklikul ja regionaalsel tasandil läbi viidud uurimus näitab , et Rumeenia peredes ei jäeta lapsi rohkem hooletusse ega ahistata seksuaalselt rohkem kui teistes riikides , ütles lastekaitseagentuuri ANPDC ametnik Theodora Bertzi .
71816	191	S	Riiklikul ja regionaalsel tasandil läbi viidud uurimus näitab , et Rumeenia peredes ei jäeta lapsi hooletusse ega ahistata , ütles lastekaitseagentuuri ANPDC ametnik Theodora Bertzi .
			
376625	698	O	Eestis on üle saja hooldekodu , kus elab rohkem kui 3000 eakat ja puudega inimest .
376625	698	S	Eestis on üle saja hooldekodu , kus elab 3000 eakat ja puudega inimest .
			
609130	1789	O	Mullu oli eraisikute haldusrikkumisi veerandi võrra rohkem kui kaks aastat varem .
609130	1789	S	Oli eraisikute haldusrikkumisi veerandi võrra rohkem kui kaks aastat varem .
			
2025	9200	O	Zjuganov luiskas lääne kapitalistidele veel rohkem kui Tshubais ja Gaidar .
2025	9200	S	Zjuganov luiskas lääne kapitalistidele .
			
440007	750	O	Peaminister Jean Chretien ennustas 1995. aastal , et iseseisvuse toetajaid on vähem kui 40% , kuid hääletuse tulemused olid peaaegu võrdsed .
440007	750	S	Peaminister Jean Chretien ennustas 1995. aastal , et iseseisvuse toetajaid on vähem kui 40% , kuid hääletuse tulemused olid võrdsed .
			
213084	2967	O	Kui viimasest vaktsineerimisest pole möödas rohkem kui aasta ja enesetunne on hea , siis pole see vajalik .
213084	2967	S	Kui viimasest vaktsineerimisest pole möödas ja enesetunne on hea , pole see vajalik .
			
406742	1093	O	Supelrandade liivane põhi on umbes sama toimega kui liivapaber ning kummist või plastikust lootsik ei pea vastu rohkem kui paar hooaega .
406742	1093	S	Supelrandade liivane põhi on sama toimega kui liivapaber ning kummist või plastikust lootsik ei pea vastu .
			
632281	37633	O	- kindlaks tehtud erinevuse võrra , kui see moodustab rohkem kui 5% , kuid mitte rohkem kui 20% tegelikult kindlaksmääratud alast ,
632281	37633	S	- kindlaks tehtud erinevuse võrra , kui see moodustab kindlaksmääratud alast ,
			
51977	3262	O	""" Sain jah natuke rohkem kui pensionärile kohane , "" kostab mees , kes andis Eestile oma metallraha ."
51977	3262	S	""" Sain , "" kostab mees , kes andis Eestile oma metallraha ."
			
62959	2801	O	""" Pered käivad üldiselt vähem kui klassid , "" hindab Metsamoori perepargi jõulumaa loonud Irje Karjus ."
62959	2801	S	""" Pered käivad , "" hindab Metsamoori perepargi jõulumaa loonud Irje Karjus ."
			
384152	2330	O	“ Klientidega tuleb kohapeal ja näost näkku suhelda , ” oli jänkist juhi põhjendus , kes väitis , et 30 aastat tagasi müüdi Ameerikas kokat ilma arvutiteta rohkem kui praegu , ja leidis , et tema alluvad istuvad liiga palju arvuti taga .
384152	2330	S	“ Klientidega tuleb näkku suhelda , ” oli jänkist juhi põhjendus , kes väitis , et 30 aastat tagasi müüdi Ameerikas kokat ilma arvutiteta , ja leidis , et tema alluvad istuvad arvuti taga .
			
200370	8181	O	Pesamuna Jaak Joonas hüppas kolmikut natuke rohkem kui Jaanus samas eas , kaugushüppes pole ta aga vanima venna tulemuseni küündinud .
200370	8181	S	Pesamuna Jaak Joonas hüppas kolmikut , kaugushüppes pole ta aga vanima venna tulemuseni küündinud .
			
28477	788	O	Seal on neid õieti rohkem kui üks .
28477	788	S	On neid rohkem kui üks .
			
521795	219	O	Eesti Päevalehte trükiti möödunud kuul 100 võrra vähem kui juulis , mis teeb keskmiseks trükiarvuks 33 700.
521795	219	S	Eesti Päevalehte trükiti möödunud kuul .
			
527236	351	O	Sellega ületati Euroopa Liidu nõue , et rahvahääletus kehtib vaid rohkem kui 50protsendise osavõtu korral .
527236	351	S	Sellega ületati Euroopa Liidu nõue , et rahvahääletus kehtib kui 50protsendise osavõtu korral .
			
470540	3225	O	3.3.2. laps on puudunud lasteasutusest rohkem kui üks kuu ja lapsevanem ei ole lasteasutusele puudumise põhjustest teatanud ;
470540	3225	S	3.3.2 . laps on puudunud ja lapsevanem ei ole lasteasutusele puudumise põhjustest teatanud ;
			
705125	131422	O	blacksoul: mul teiste muresi rohkem kui enda omasi südamel kanda
705125	131422	S	Blacksoul : mul teiste muresi enda omasi südamel kanda
			
493645	13840	O	Tänu ülikoolile teatakse Tartut paljudes maades juba praegu rohkem kui Tallinna .
493645	13840	S	Tänu ülikoolile teatakse Tartut paljudes maades .
			
599356	602	O	Käesoleva aasta lõpp on olnud eriline selle poolest , et vähem kui 1 kuu enne aasta lõppu korrigeeritakse aastaseid kasumiprognoose allapoole .
599356	602	S	Käesoleva aasta lõpp on olnud eriline selle poolest , et 1 kuu enne aasta lõppu korrigeeritakse aastaseid kasumiprognoose .
			
394	4008	O	Abikaasa loeb veel rohkem kui mina ja seetõttu kingin ikka raamatuid .
394	4008	S	Abikaasa loeb ja kingin raamatuid .
			
102340	2076	O	Keskkonnaministri arvates on ühisauto kasulik ennekõike nendele juhtidele , kes sõidavad aastas läbi vähem kui 10 000 kilomeetrit .
102340	2076	S	Keskkonnaministri arvates on ühisauto kasulik nendele juhtidele , kes sõidavad aastas läbi .
			
58662	5995	O	"Tegelikult ma räägin natuke ja saan aru rohkem kui natuke . """
58662	5995	S	"Ma räägin ja saan aru . """
			
393187	0	O	Läti naised otsivad välismaalt mehi rohkem kui Eesti ja Leedu naised kokku .
393187	0	S	Läti naised otsivad välismaalt mehi kui Eesti ja Leedu naised kokku .
			
471851	1272	O	Tegelikult paneb Tallinna korteriskandaal meid kõiki moraalselt proovile rohkem kui arvata oskaksime .
471851	1272	S	Paneb Tallinna korteriskandaal meid kõiki proovile arvata oskaksime .
			
462131	5786	O	Me peame tõdema ka kaugemat perspektiivi , et väike Eesti ei vaja ilmselt seda kõrgharidusega inimeste hulka , mida praeguseks rohkem kui 30 end kõrgkooliks nimetavat asutust andma on hakanud .
462131	5786	S	Me peame tõdema kaugemat perspektiivi , et väike Eesti ei vaja seda kõrgharidusega inimeste hulka , mida praeguseks 30 end kõrgkooliks nimetavat asutust andma on hakanud .
			
261834	399	O	Kokku on kavas läbida natuke rohkem kui 40 000 meremiili , seilates seejuures kolmel ookeanil ja külastades oma teekonnal kolmeküm-met kahte erinevat maailma riiki .
261834	399	S	On kavas läbida , seilates kolmel ookeanil ja külastades oma teekonnal kolmeküm-met kahte erinevat maailma riiki .
			
23992	820	O	Kahe aasta pärast peaks internetiühendus olema loodud vähemalt 280 ehk rohkem kui pooles rahvaraamatukogudest .
23992	820	S	Kahe aasta pärast peaks internetiühendus olema loodud 280 ehk rohkem kui pooles rahvaraamatukogudest .
			
132353	425	O	Lõpetamisega seonduvad kulud on suured nii poiste kui tüdrukute jaoks - kohati maksab ülikond rohkem kui lõpukleit .
132353	425	S	Lõpetamisega seonduvad kulud on suured nii poiste kui tüdrukute jaoks - maksab ülikond .
			
543271	355	O	Kolmeseid loobiti rohkem kui kahepunktiviskeid , neid tabati 33st 11 ( esimesel poolajal 18st 4 ) .
543271	355	S	Kolmeseid loobiti , neid tabati 33st 11 ( esimesel poolajal 18st 4 ) .
			
78230	2941	O	Ja sõnad pole kunagi rohkem kui lihtsalt sõnad - kirjasõnad , suusõnad .
78230	2941	S	Ja sõnad pole rohkem kui sõnad - kirjasõnad , suusõnad .
			
45683	31	O	Kaks suurt šveitsi panka kavatsevad lubada ekspertidel uurida rohkem kui kahte miljonit natsiokupatsiooni aegset pangaarvet , et oleks võimalik holokaustis ellujäänute nõudeid tõendada või ümber lükata .
45683	31	S	Kaks suurt šveitsi panka kavatsevad lubada ekspertidel uurida kahte miljonit natsiokupatsiooni aegset pangaarvet , et oleks võimalik holokaustis ellujäänute nõudeid tõendada või ümber lükata .
			
426069	1845	O	Ma ei saa aru , mis alusel väidab Varik , et põllumajanduse langus on peatunud , kui valitsuse ja tootjate läbirääkimistel on selgunud , et tuludefitsiit on KMÜ võimul olles kasvanud rohkem kui kaks korda ja on juba üle kahe miljardi krooni .
426069	1845	S	Ma ei saa aru , mis alusel väidab Varik , et põllumajanduse langus on peatunud , kui valitsuse ja tootjate läbirääkimistel on selgunud , et tuludefitsiit on KMÜ võimul olles kasvanud ja on üle kahe miljardi krooni .
			
696748	114321	O	Samal aastal esitati pankrotitoimkondadele kokku põhivõlanõudeid rohkem kui 40 miljoni krooni suuruses summas .
696748	114321	S	Samal aastal esitati pankrotitoimkondadele kokku põhivõlanõudeid suuruses summas .
			
583471	786	O	Oma sõnumi edastamise viisi otsib palavikuliselt ka suurtööstus , kes toodab kaupa rohkem kui eluks vajalik .
583471	786	S	Oma sõnumi edastamise viisi otsib suurtööstus , kes toodab kaupa .
			
492693	1298	O	“ Pole mõtet usaldada välisriigi ajakirjanikke rohkem kui Eesti kohut , ” mainis Meidra .
492693	1298	S	“ Pole mõtet usaldada välisriigi ajakirjanikke , ” mainis Meidra .
			
174555	4220	O	"Selline hoiak sobib "" iibeinstrumendiks "" veel vähem kui lihtne rahapakkumine ."
174555	4220	S	"Selline hoiak sobib "" iibeinstrumendiks "" ."
			
622547	2613	O	Ele arvab , et 55 eluaastat ütleb ehk teda ümbritsevatele inimestele rohkem kui talle endale – on ta ju ikka sama nooruslik ja rõõmsameelne .
622547	2613	S	Ele arvab , et 55 eluaastat ütleb ehk teda ümbritsevatele inimestele rohkem kui talle endale – on ta sama nooruslik ja rõõmsameelne .
			
442860	134	O	See pole näitus eesti suvitajatest Suhhumi kuurortides , vaid eestlastest ja nende järeltulijatest , kes rohkem kui sada aastat tagasi ümberasumislainega Kaukaasiasse saabusid ja Suhhumi kodu rajasid .
442860	134	S	See pole näitus eesti suvitajatest Suhhumi kuurortides , vaid eestlastest ja nende järeltulijatest , kes sada aastat tagasi ümberasumislainega Kaukaasiasse saabusid ja Suhhumi kodu rajasid .
			
105096	381	O	Tolliameti pressiesindaja Aivar Pau teatel hõlmas uuring rohkem kui 33 000 kommertsveokit , mille juhtidel paluti täita vastav ankeet , et kaardistada piiripunktis tehtavatele toimingutele kuluvat aega .
105096	381	S	Tolliameti pressiesindaja Aivar Pau teatel hõlmas uuring .
			
365247	74	O	"Täna avatakse Ajaloo Instituudi näitustesaalis Rüütli 10 näitus "" Eesti loomastik läbi aja "" , väljapaneku vanimad eksponaadid on rohkem kui 50 000 aasta vanused ."
365247	74	S	"Avatakse Ajaloo Instituudi näitustesaalis Rüütli 10 näitus "" Eesti loomastik läbi aja "" , väljapaneku vanimad eksponaadid on rohkem kui 50 000 aasta vanused ."
			
475259	936	O	“ Ses mõttes kaotab Uldis rohkem kui ükski teine läti luuletaja , keda on tõlgitud võõrkeelde .
475259	936	S	“ Ses mõttes kaotab Uldis .
			
64022	836	O	Ka Wolandis ( Vsevolod Sobolev ) polnud deemonlikku suurmängurit rohkem kui lastejutu vanapaganas .
64022	836	S	Wolandis ( Vsevolod Sobolev ) polnud deemonlikku suurmängurit rohkem kui lastejutu vanapaganas .
			
4272	388974	O	Lapsi kasvatavad Niskamäe talu ja vanaperenaine , Aarne ja Ilona , keda lapsed armastavad ja usaldavad rohkem kui oma ema .
4272	388974	S	Lapsi kasvatavad Niskamäe talu ja vanaperenaine , Aarne ja Ilona , keda lapsed armastavad ja usaldavad .
			
385807	4441	O	Pärast valmisehitamist loodab uus omanik selle rohkem kui nelja milni krooni eest maha müüa .
385807	4441	S	Pärast valmisehitamist loodab uus omanik selle nelja milni krooni eest maha müüa .
			
442687	1972	O	Euroopa Liiduga liitudes hakkab laevapilet Helsingist Tallinna maksma oluliselt rohkem kui Helsingist Stockholmi , sest Soome ja Rootsi vahel seilavatel laevadel on kõikide euroreeglite kiuste  tax-free  kaubandus suudetud säilitada .
442687	1972	S	Euroopa Liiduga liitudes hakkab laevapilet Helsingist Tallinna maksma , sest Soome ja Rootsi vahel seilavatel laevadel on kõikide euroreeglite kiuste tax-free kaubandus suudetud säilitada .
			
170589	434	O	Juba esimesel veerandajal rohkem kui kümne punktiga juhtima asunud Capitals domineeris peaaegu terve mänguaja , kuid normaalaja lõpusekundil viigistas Tulip kolmesega - 86 : 86.
170589	434	S	Esimesel veerandajal kümne punktiga juhtima asunud Capitals domineeris terve mänguaja , kuid normaalaja lõpusekundil viigistas Tulip kolmesega - 86 : 86.
			
700916	25446	O	Ka linnad ei ole veel kogu Eesti , kuid hääli on seal rohkem kui väikevaldades .
700916	25446	S	Linnad ei ole kogu Eesti , kuid hääli on rohkem kui väikevaldades .
			
201083	1830	O	Olgugi , et hea kohvi alus on hea tooraine , mõjutavad barista oskused valmisjoogi kvaliteeti rohkem kui kõik muud tegurid .
201083	1830	S	Olgugi , et hea kohvi alus on hea tooraine , mõjutavad barista oskused valmisjoogi kvaliteeti .
			
698402	22957	O	3 ) ohtlikku kemikaali , mille viskoossus 20 °C juures on üle 25 mPa või laadimistemperatuur on alla 15 °C jäävast sulamistemperatuurist kõrgem vähem kui 5 °C või üle 15 °C jäävast sulamistemperatuuri kõrgem vähem kui 10 °C ;
698402	22957	S	3 ) ohtlikku kemikaali , mille viskoossus 20 ° C juures on üle 25 mPa või laadimistemperatuur on alla 15 ° C jäävast sulamistemperatuurist kõrgem või 15 ° C jäävast sulamistemperatuuri kõrgem ;
			
349819	460	O	Samal ajal tegi raadiojaam Eho Moskvõ küsitluse , et kelle valiks raadiokuulaja presidendiks - Vladimir Putini või Hodorkovski - ning sai põneva tulemuse : rohkem kui seitsmest tuhandest vastajast hääletas 75 protsenti Hodorkovski ja vaid 25 protsenti Putini poolt .
349819	460	S	Samal ajal tegi raadiojaam Eho Moskvõ küsitluse , et kelle valiks raadiokuulaja presidendiks - Vladimir Putini või Hodorkovski - ning sai põneva tulemuse : seitsmest tuhandest vastajast hääletas 75 protsenti Hodorkovski ja 25 protsenti Putini poolt .
			
183007	712	O	Kui kunagi sotsiaalmaksu kehtestamisel otsustati , et tervisele arvestatakse 13% maksumaksja brutotulu kohta , eeldati , et maksumaksjaid on vähemalt saja tuhande võrra rohkem kui neid praegu on .
183007	712	S	Kui sotsiaalmaksu kehtestamisel otsustati , et tervisele arvestatakse 13% maksumaksja brutotulu kohta , eeldati , et maksumaksjaid on saja tuhande võrra rohkem kui neid praegu on .
			
632434	21595	O	Alapunktides ii ja v märgitud ürituste puhul on kõnealuseks piiriks enamikul juhtudel mitte vähem kui 150 000 eurot aastas ja kõikidel juhtudel mitte rohkem kui 300 000 eurot aastas .
632434	21595	S	Alapunktides ii ja v märgitud ürituste puhul on kõnealuseks piiriks enamikul juhtudel ja kõikidel juhtudel rohkem kui 300 000 eurot aastas .
			
377180	6589	O	Vaatamata sellele , et kirikus käiakse vähe ( Eestis on vaid 70 000 luteri kiriku liiget ) , määrab usuline taust meie käitumist ja tavasid rohkem kui miski muu .
377180	6589	S	Vaatamata sellele , et kirikus käiakse ( Eestis on 70 000 luteri kiriku liiget ) , määrab usuline taust meie käitumist ja tavasid .
			
549177	2864	O	24-aastane Maarek aga märkis , et pulli sai rohkem kui 150-kroonise pileti eest .
549177	2864	S	24-aastane Maarek aga märkis , et pulli sai 150-kroonise pileti eest .
			
218684	3549	O	""" Kuid praegu meeldib mulle tänavune tiim küll rohkem kui mullune , "" ütles Laansoo ."
218684	3549	S	""" Kuid meeldib mulle tänavune tiim , "" ütles Laansoo ."
			
522175	0	O	Teleuudistest sai kuuldud , et pension tõuseb meil aprillikuust rohkem kui 100 krooni võrra .
522175	0	S	Teleuudistest sai kuuldud , et pension tõuseb meil aprillikuust .
			
398134	2825	O	Seevastu see , keda kirjanduskriitikas lummab kirjutaja isiksus , tema originaalne , idiosünkraatiline vaim , leiab Krulli tekstidest rohkem kui tavalistest akadeemilistest käsitlustest .
398134	2825	S	See , keda kirjanduskriitikas lummab kirjutaja isiksus , tema originaalne , idiosünkraatiline vaim , leiab Krulli tekstidest .
			
424715	3647	O	Vähene sündimus mõjutab tulevikus majanduselu hoopiski rohkem kui täna soovitakse tunnistada .
424715	3647	S	Vähene sündimus mõjutab tulevikus majanduselu kui soovitakse tunnistada .
			
284889	0	O	Kolmandat hooaega Draamateatris käivitatud gümnaasiumiastme kirjandivõistlusele saatis tänavu töid 145 noort autorit , mis on enam kui kaks korda rohkem kui mullu .
284889	0	S	Kolmandat hooaega Draamateatris käivitatud gümnaasiumiastme kirjandivõistlusele saatis töid 145 noort autorit , mis on kaks korda rohkem kui mullu .
			
